,id,name,alias,categories,description,latitude,longitude,address,phone,rating,review_count,review,url,image_url,is_closed,price,hours,transactions,languages,attributes,transit,best_time,delivery,pickup,online_ordering
0,GBDHMbAOJ5xICFF95Z5HfQ,Kathmandu Tandoori House,kathmandu-tandoori-house-madrid,"[{'alias': 'indpak', 'title': 'Indian'}, {'alias': 'pakistani', 'title': 'Pakistani'}, {'alias': 'himalayan', 'title': 'Himalayan/Nepalese'}]",Indian Pakistani Himalayan/Nepalese ,40.47426,-3.57859,"Calle Acuario, 11, 28042 Madrid, Spain",+34911269719,5.0,21,"Great option for Indian and nepali food. The chicken momos were excellent and the sauce that comes with them was stellar. 
Chicken biryani was also good,.... What a wonderful surprise to be in a neighborhood near the Madrid neighborhood & to find excellent India/Nepali food! Very delicious with attentive service.. I had the tikka masala and tandoori chicken.  Both were very very good!  The host was very nice and helpful. It's a quiet neighborhood restaurant with.... ",https://www.yelp.com/biz/kathmandu-tandoori-house-madrid?adjust_creative=z8U9P3NucyfGO41pAru5Lw&utm_campaign=yelp_api_v3&utm_medium=api_v3_business_search&utm_source=z8U9P3NucyfGO41pAru5Lw,https://s3-media2.fl.yelpcdn.com/bphoto/sS8gTXlL5Z6x9O3DzPJvUA/o.jpg,False,,,[],,,,,,,
1,oPERop8gNCRC9LmbaXV46w,La General,la-general-madrid,"[{'alias': 'pizza', 'title': 'Pizza'}, {'alias': 'bakeries', 'title': 'Bakeries'}]",Pizza Bakeries ,40.4706199,-3.58068,"Calle Planeta, 3, 28042 Madrid, Spain",+34916035701,5.0,12,"Man,  even when looking for good eats internationally Yelpers come to the rescue 

Was on a layover awaiting a flight home from Madrid's Barajas airport and.... Great option when in transit close to Madrid Barajas airport. Food was good, service was friendly and price was reasonable. 
We had a party of 7, and.... What a great little spot almost right across the street from the Ibis Hotel Barajas. I had the mango curry chicken at my server's recommendation and it was.... ",https://www.yelp.com/biz/la-general-madrid?adjust_creative=z8U9P3NucyfGO41pAru5Lw&utm_campaign=yelp_api_v3&utm_medium=api_v3_business_search&utm_source=z8U9P3NucyfGO41pAru5Lw,https://s3-media2.fl.yelpcdn.com/bphoto/Nq9scW8nAou4eoCNYM9wJQ/o.jpg,False,,,[],,,,,,,
2,4NyuSViM9LOFVYuMTZRmTw,Al Traste Fun And Food,al-traste-fun-and-food-madrid,"[{'alias': 'burgers', 'title': 'Burgers'}, {'alias': 'pizza', 'title': 'Pizza'}, {'alias': 'sandwiches', 'title': 'Sandwiches'}]",Burgers Pizza Sandwiches ,40.470543,-3.580493,"Avenida General, 47, 28042 Madrid, Spain",+34913293799,4.0,20,"For me the best place in the area. 
Really good meat and very good service. 
Nice beers. 
Go for the grilled meat!
Also with extended hours which is very.... We were staying in a cheap hotel up the street and were flying out or Madrid airport the next day. This was close to the hotel so we decided to give it a.... On the last night of a two week holiday in Spain we checked into a typical airport area hotel and ventured out for one last dinner in Madrid. We slid Into.... ",https://www.yelp.com/biz/al-traste-fun-and-food-madrid?adjust_creative=z8U9P3NucyfGO41pAru5Lw&utm_campaign=yelp_api_v3&utm_medium=api_v3_business_search&utm_source=z8U9P3NucyfGO41pAru5Lw,https://s3-media2.fl.yelpcdn.com/bphoto/ORQsb1IUfXia_pX-7hNA3w/o.jpg,False,€€,,[],,,,,,,
3,rqy1GJvR3S-ZEqXO8xlpwg,La Torino,la-torino-madrid,"[{'alias': 'argentine', 'title': 'Argentine'}]",Argentine ,40.4739362413989,-3.57743918895721,"Plaza Hermanos Falco, 4, 28042 Madrid, Spain",+34913054099,5.0,5,I've eaten here twice while in Bajaras.  The first time I had the stuffed sea bass which was amazing.  The second time I had  the mixed salad and oxtail.... I loved this place! I had a few hour layovers in Madrid. It's about a 9 minute Uber ride from the airport. So if you have a bit of time between flights it's.... Loved this place! We had an unremarkable dinner and were looking for somewhere to celebrate the end of our 10 days in Spain. The staff were so friendly and.... ,https://www.yelp.com/biz/la-torino-madrid?adjust_creative=z8U9P3NucyfGO41pAru5Lw&utm_campaign=yelp_api_v3&utm_medium=api_v3_business_search&utm_source=z8U9P3NucyfGO41pAru5Lw,https://s3-media3.fl.yelpcdn.com/bphoto/J3bScQ0Y2zgfJyEqgJZBRQ/o.jpg,False,€€,,[],,,,,,,
4,s4OrjgdBgEWM-g6zpzedrA,Campanilla,campanilla-madrid,"[{'alias': 'spanish', 'title': 'Spanish'}]",Spanish ,40.47265,-3.58163,"Avenida de Logroño, 132, 28042 Madrid, Spain",+34913290965,5.0,67,"Nos quedamos una noche en Barajas  y encontramos este pequeño restaurante familiar a través de Yelp. Fue una experiencia inolvidable! La comida fue.... This was our last night in Spain. We needed a meal within walking distance from the airport hotel. We did not expect to have the most memorable of our.... Such a great experience.  I am from Louisville, KY - the food was great.  Great wine.  Very authentic!  Would absolutely go back.. ",https://www.yelp.com/biz/campanilla-madrid?adjust_creative=z8U9P3NucyfGO41pAru5Lw&utm_campaign=yelp_api_v3&utm_medium=api_v3_business_search&utm_source=z8U9P3NucyfGO41pAru5Lw,https://s3-media2.fl.yelpcdn.com/bphoto/H3cl_VSVeqMGW-8qLaECJA/o.jpg,False,€,,[],,,,,,,
5,dnSMbNWIwcOrr71W4tkrHA,Asador Nuevo Porche,asador-nuevo-porche-madrid,"[{'alias': 'steak', 'title': 'Steakhouses'}]",Steakhouses ,40.47091,-3.5826,"Calle Alaro, 5, 28042 Madrid, Spain",+34917478144,5.0,8,"All things are perfect. Food is fantastic. The boss is kindly and friendly. Wine is tasted smoothy and also more beer. Quite a good representative of the traditional ""asador"" (rosters) tradition in Spain. Impressive interior reproducing a Basque vernacular farm house. With.... We had an amazing time. Food was excellent and the service was tremendous. Our server was very helpful and even the owner attended us. If you want a good.... ",https://www.yelp.com/biz/asador-nuevo-porche-madrid?adjust_creative=z8U9P3NucyfGO41pAru5Lw&utm_campaign=yelp_api_v3&utm_medium=api_v3_business_search&utm_source=z8U9P3NucyfGO41pAru5Lw,https://s3-media1.fl.yelpcdn.com/bphoto/u0mVWHcpE4lAZ5rQ-Xds8g/o.jpg,False,€€€,,[],,,,,,,
6,aJGG9mhTNK2WYUOyEWc3lQ,Bahía Taberna,bahía-taberna-madrid,"[{'alias': 'mediterranean', 'title': 'Mediterranean'}, {'alias': 'tabernas', 'title': 'Tabernas'}, {'alias': 'cocktailbars', 'title': 'Cocktail Bars'}]",Mediterranean Tabernas Cocktail Bars ,40.4637733471259,-3.59229457539368,"Calle de la Bahía de Palma, 9, 28042 Madrid, Spain",+34917476944,4.0,15,"OMG!! 
I stopped in for a glass of wine. I'm vegan and figured they didn't gave anything but asked if they could make a salad. Wow wow wow!! The chef made.... Absolutely delicious food! Perfect pit stop on the way to the airport, residential location therefore it's very quiet. Great selection of beers, there's.... Suprise! Suprise! You may think that what in the world this restaurant is doing in this part of city. And you are right, there is no explanation. In any.... ",https://www.yelp.com/biz/bah%C3%ADa-taberna-madrid?adjust_creative=z8U9P3NucyfGO41pAru5Lw&utm_campaign=yelp_api_v3&utm_medium=api_v3_business_search&utm_source=z8U9P3NucyfGO41pAru5Lw,https://s3-media3.fl.yelpcdn.com/bphoto/Q98wzHhdLBE-lsKu7fVr2Q/o.jpg,False,€€€,,[],,,,,,,
7,2f0zjZAnAD5iwtjGjjm_vQ,La Latina,la-latina-madrid-4,"[{'alias': 'gastropubs', 'title': 'Gastropubs'}]",Gastropubs ,40.4733697148819,-3.58184965358426,"Av. de Logroño, 144, 28042 Madrid, Spain",+34912976068,5.0,9,"This is a nice little charming restaurant in Barajas.  I was really happy with the quality of the food and how flavorful it was.  I walked by the night.... In the Madrid airport area for one evening ahead of a flight the next day and staying down the street at the Clement Barajes Hotel.

On a Saturday night, I.... A great place for lunch! A delicious salad, a main course, a bottle of pineapple juice and a tasty pudding only cost me 10 euros altogether. Their dishes.... ",https://www.yelp.com/biz/la-latina-madrid-4?adjust_creative=z8U9P3NucyfGO41pAru5Lw&utm_campaign=yelp_api_v3&utm_medium=api_v3_business_search&utm_source=z8U9P3NucyfGO41pAru5Lw,https://s3-media2.fl.yelpcdn.com/bphoto/IcWindERzCi4GEDzkI-xnw/o.jpg,False,€,,[],,,,,,,
8,K04mIcUwP0D3fAUj05WCXQ,La Vina de Nerea,la-vina-de-nerea-madrid,"[{'alias': 'spanish', 'title': 'Spanish'}]",Spanish ,40.472952664342,-3.58067329372439,"Avenida de Logrono, 128, 28042 Madrid, Spain",+34913057206,4.0,4,"Very friendly and casual.  Quick service. Nice wine selection at reasonable prices and excellent tapas. A great place to unwind after a busy day of.... Outstanding tapas. I let the wait staff choose as I could not make out one from another. Must try the croquette, Spanish ham and a fish pâté. Try the house.... Was staying in nearby airport hotel for flight out next day. About a ten minute walk from TRYP Hotel is this lovely restaurant. Actually two restaurants in.... ",https://www.yelp.com/biz/la-vina-de-nerea-madrid?adjust_creative=z8U9P3NucyfGO41pAru5Lw&utm_campaign=yelp_api_v3&utm_medium=api_v3_business_search&utm_source=z8U9P3NucyfGO41pAru5Lw,https://s3-media1.fl.yelpcdn.com/bphoto/8yAuMkyTX1yDUFYmtEKEjw/o.jpg,False,€€,,[],,,,,,,
9,opj_cFgt18TjKzpHtLTfGw,Martes 13,martes-13-madrid-2,"[{'alias': 'mediterranean', 'title': 'Mediterranean'}, {'alias': 'gastropubs', 'title': 'Gastropubs'}, {'alias': 'spanish', 'title': 'Spanish'}]",Mediterranean Gastropubs Spanish ,40.4729,-3.58176,"Avenida de Logroño, 138, 28042 Madrid, Spain",+34917477969,5.0,3,This isn't just a casual five stars.  Completely legit.  Stunningly ridiculous.  Do not pass on the artichokes.  Best I've ever had.. ,https://www.yelp.com/biz/martes-13-madrid-2?adjust_creative=z8U9P3NucyfGO41pAru5Lw&utm_campaign=yelp_api_v3&utm_medium=api_v3_business_search&utm_source=z8U9P3NucyfGO41pAru5Lw,https://s3-media4.fl.yelpcdn.com/bphoto/CqzS_yUJ2gvFTOp1a8tOkw/o.jpg,False,,,[],,,,,,,
10,umvcIjSeRS61R8jQHKtatQ,El Txoko de Ander,el-txoko-de-ander-madrid,"[{'alias': 'spanish', 'title': 'Spanish'}]",Spanish ,40.47267,-3.58209,"Avenida de Logroño, 327, 28042 Madrid, Spain",+34913056201,4.0,5,"When you don't speak a language, ordering can be fun!  But they do have an English menu here.  This place seems to be one of three( I don't know) but we ate.... While in town for a short time and with my wife feeling unwell, I sought out a place to order carry out. We discovered El Txoko, and studied the menu for a.... This place has restored my faith in humanity. After an absolute nightmare of a day, with an historic snowfall in Madrid and the subsequent closure of Madrid.... ",https://www.yelp.com/biz/el-txoko-de-ander-madrid?adjust_creative=z8U9P3NucyfGO41pAru5Lw&utm_campaign=yelp_api_v3&utm_medium=api_v3_business_search&utm_source=z8U9P3NucyfGO41pAru5Lw,https://s3-media1.fl.yelpcdn.com/bphoto/TXpI56YbFRNsVk0QhaWV9A/o.jpg,False,,,[],,,,,,,
11,jkLWB4t0e1vu2k8aYtChYg,La Caprichosa,la-caprichosa-madrid-3,"[{'alias': 'tabernas', 'title': 'Tabernas'}]",Tabernas ,40.4731541799639,-3.57744724001158,"Plaza Hermanos Falcó y Álvarez de Toledo, 21, 28042 Madrid, Spain",+34913010395,5.0,2,"We didn't expect much from this unassuming taverna, but we were pleasantly surprised! Great service, fabulous food, and a pleasant atmosphere. We would go.... ",https://www.yelp.com/biz/la-caprichosa-madrid-3?adjust_creative=z8U9P3NucyfGO41pAru5Lw&utm_campaign=yelp_api_v3&utm_medium=api_v3_business_search&utm_source=z8U9P3NucyfGO41pAru5Lw,https://s3-media4.fl.yelpcdn.com/bphoto/w-U17MTEQ2wagKm2JEoX9A/o.jpg,False,€€,,[],,,,,,,
12,Br4CMLUaekIW3QLenpFl3A,Sienna,sienna-madrid-3,"[{'alias': 'pizza', 'title': 'Pizza'}]",Pizza ,40.4720918,-3.578968,"Avenida General, 29, 28042 Madrid, Spain",+34917479227,1.0,4,"Ordered the medium sized pizza. It was clearly frozen, bought in a supermarket. Took a bite. Complained and left.. ",https://www.yelp.com/biz/sienna-madrid-3?adjust_creative=z8U9P3NucyfGO41pAru5Lw&utm_campaign=yelp_api_v3&utm_medium=api_v3_business_search&utm_source=z8U9P3NucyfGO41pAru5Lw,https://s3-media3.fl.yelpcdn.com/bphoto/7NDPJ7exuyYTVKKnI56BAA/o.jpg,False,€,,[],,,,,,,
13,wZVq0beIAdordAfZjqwRqg,Tuk Tuk,tuk-tuk-barajas,"[{'alias': 'panasian', 'title': 'Pan Asian'}]",Pan Asian ,40.4704,-3.58038,"Calle Feriantes, 1, 28042 Barajas, Spain",+34918391771,4.0,3,"A great visit

Our trip to Spain is ending.  As I sit on our plane flying home to the US, getting caught up on Yelp reviews, it's nice thinking back to the.... Spent one night near the Barajas airport on my way back to NYC. This place was close and even if I wanted Spanish food for my last night, I decided to come.... ",https://www.yelp.com/biz/tuk-tuk-barajas?adjust_creative=z8U9P3NucyfGO41pAru5Lw&utm_campaign=yelp_api_v3&utm_medium=api_v3_business_search&utm_source=z8U9P3NucyfGO41pAru5Lw,https://s3-media1.fl.yelpcdn.com/bphoto/DeOBJHBrdSDFM9NYS8mMXg/o.jpg,False,,,[],,,,,,,
14,_x7v8bLelMpLwkarZsOidA,Mas Q Menos,mas-q-menos-madrid-14,"[{'alias': 'breakfast_brunch', 'title': 'Breakfast & Brunch'}, {'alias': 'sandwiches', 'title': 'Sandwiches'}, {'alias': 'tapasmallplates', 'title': 'Tapas/Small Plates'}]",Breakfast & Brunch Sandwiches Tapas/Small Plates ,40.483936,-3.568166,"Aeropuerto de Madrid-Barajas, Terminal 4, 28042 Madrid, Spain",,5.0,9,"I've been to Madrid's airport countless times, and this is my go-to café every time I pass through Terminal 4S. They have a decent coffee and a good.... I'm not saying it's the best place on earth, it's just one of the most solid restaurants within the airport. Definitely, one of like three places with.... For an airport restaurant, this place was the best! I ordered off a touch screen (which was very convenient and quick) and I got a couple items, thinking.... ",https://www.yelp.com/biz/mas-q-menos-madrid-14?adjust_creative=z8U9P3NucyfGO41pAru5Lw&utm_campaign=yelp_api_v3&utm_medium=api_v3_business_search&utm_source=z8U9P3NucyfGO41pAru5Lw,https://s3-media2.fl.yelpcdn.com/bphoto/UAaPh9fVU6v-rs8JACV7Gw/o.jpg,False,,,[],,,,,,,
15,4foaYF42QAbdMTfDtfpmkQ,Al Tran Tran,al-tran-tran-madrid,"[{'alias': 'gastropubs', 'title': 'Gastropubs'}, {'alias': 'spanish', 'title': 'Spanish'}]",Gastropubs Spanish ,40.4723602998988,-3.5819798335433,"Avenida de Logroño, 323, 28042 Madrid, Spain",+34615025355,4.0,1,,https://www.yelp.com/biz/al-tran-tran-madrid?adjust_creative=z8U9P3NucyfGO41pAru5Lw&utm_campaign=yelp_api_v3&utm_medium=api_v3_business_search&utm_source=z8U9P3NucyfGO41pAru5Lw,https://s3-media2.fl.yelpcdn.com/bphoto/Vv2aWISAZXGrv4gJbZ8zyA/o.jpg,False,,,[],,,,,,,
16,65kJdB-l3Ey45z6HLbeMfw,Casa Nemesia,casa-nemesia-madrid,"[{'alias': 'seafood', 'title': 'Seafood'}]",Seafood ,40.4740441353175,-3.57746933312603,"Plaza Mayor de Barajas, 12, 28042 Madrid, Spain",+34913055966,4.0,1,,https://www.yelp.com/biz/casa-nemesia-madrid?adjust_creative=z8U9P3NucyfGO41pAru5Lw&utm_campaign=yelp_api_v3&utm_medium=api_v3_business_search&utm_source=z8U9P3NucyfGO41pAru5Lw,https://s3-media2.fl.yelpcdn.com/bphoto/GlM7iHH1mucPNM9iTwO2tg/o.jpg,False,,,[],,,,,,,
17,JUv9q86TI5hy4mGiYjX_6Q,Dreams,dreams-madrid,"[{'alias': 'beerbar', 'title': 'Beer Bar'}, {'alias': 'cafeteria', 'title': 'Cafeteria'}, {'alias': 'cocktailbars', 'title': 'Cocktail Bars'}]",Beer Bar Cafeteria Cocktail Bars ,40.4714088,-3.58075,"Calle Canal de Suez, 7, 28042 Madrid, Spain",+34913293044,5.0,1,,https://www.yelp.com/biz/dreams-madrid?adjust_creative=z8U9P3NucyfGO41pAru5Lw&utm_campaign=yelp_api_v3&utm_medium=api_v3_business_search&utm_source=z8U9P3NucyfGO41pAru5Lw,https://s3-media1.fl.yelpcdn.com/bphoto/KRI49Eq_PMXHqRRL5U5cXQ/o.jpg,False,,,[],,,,,,,
18,BQ3hc9Acj0_nraRrH8DkLw,La Consentida,la-consentida-madrid-3,"[{'alias': 'tapas', 'title': 'Tapas Bars'}]",Tapas Bars ,40.472289,-3.582054,"Avenida de Logroño, 323, 28042 Madrid, Spain",+34910279244,3.0,4,"On my final night in Madrid, I moved to a hotel closer to the airport so I would not have any commute issues in the am. I walked around the area looking for.... The food was good but the service left some to be desired. We were a group of four people and told our server at the beginning that we wanted separate.... ",https://www.yelp.com/biz/la-consentida-madrid-3?adjust_creative=z8U9P3NucyfGO41pAru5Lw&utm_campaign=yelp_api_v3&utm_medium=api_v3_business_search&utm_source=z8U9P3NucyfGO41pAru5Lw,https://s3-media4.fl.yelpcdn.com/bphoto/1ABqW3m2txjxR-csZWrO2Q/o.jpg,False,€€€,,[],,,,,,,
19,XTumDIwf6zaoc-pgvOCDiQ,Martinuka,martinuka-madrid,"[{'alias': 'seafood', 'title': 'Seafood'}, {'alias': 'spanish', 'title': 'Spanish'}]",Seafood Spanish ,40.47409,-3.57741,"Plaza Mayor de Barajas, 12, 28042 Madrid, Spain",+34913055966,4.0,1,,https://www.yelp.com/biz/martinuka-madrid?adjust_creative=z8U9P3NucyfGO41pAru5Lw&utm_campaign=yelp_api_v3&utm_medium=api_v3_business_search&utm_source=z8U9P3NucyfGO41pAru5Lw,https://s3-media4.fl.yelpcdn.com/bphoto/eAR1exlVg9GTJA1nIXTByw/o.jpg,False,,,[],,,,,,,
20,9x_0CSqmw0BW5j_J4Wce9w,Burger King,burger-king-madrid-7,"[{'alias': 'burgers', 'title': 'Burgers'}, {'alias': 'hotdogs', 'title': 'Fast Food'}]",Burgers Fast Food ,40.473358,-3.58241,"Avenida de Logroño, 337, 28042 Madrid, Spain",+34913010071,5.0,1,,https://www.yelp.com/biz/burger-king-madrid-7?adjust_creative=z8U9P3NucyfGO41pAru5Lw&utm_campaign=yelp_api_v3&utm_medium=api_v3_business_search&utm_source=z8U9P3NucyfGO41pAru5Lw,https://s3-media2.fl.yelpcdn.com/bphoto/5sro4a6p-NMM66ldh7FIrw/o.jpg,False,,,[],,,,,,,
21,v8CnEmPwnp95t1BV3aZbPQ,"Hostal EL Principe Plaza Hermanos Falco, 4",hostal-el-principe-plaza-hermanos-falco-4-madrid,"[{'alias': 'restaurants', 'title': 'Restaurants'}]",Restaurants ,40.47369,-3.57799,"Plaza Hermanos Falco y Alvarez de Toledo, 8, 28042 Madrid, Spain",+34917477965,5.0,2,"Can't speak for the lodging, but we ate in the restaurant and ordered the ternero menu for two. It included a 2.75"" t-bone with fries, green salad, a half.... It says this is a hostel and it is but they have an awesome restaurant. We ordered paella for two (28 Euro). We had a glass of the house red rioja wine..... ",https://www.yelp.com/biz/hostal-el-principe-plaza-hermanos-falco-4-madrid?adjust_creative=z8U9P3NucyfGO41pAru5Lw&utm_campaign=yelp_api_v3&utm_medium=api_v3_business_search&utm_source=z8U9P3NucyfGO41pAru5Lw,https://s3-media3.fl.yelpcdn.com/bphoto/gPpmRSOeONWgMPbtwljBAg/o.jpg,False,,,[],,,,,,,
22,2fFkmYWjf8yhk0_u9AI5eg,100 Montaditos,100-montaditos-madrid-37,"[{'alias': 'beerbar', 'title': 'Beer Bar'}, {'alias': 'sandwiches', 'title': 'Sandwiches'}]",Beer Bar Sandwiches ,40.4917551451927,-3.59218295663595,"Avenida de la Hispanidad, s/n, Terminal T2, 28042 Madrid, Spain",+34620243982,3.0,7,"The name of the restaurant is an exact description of the menu! 100 Montaditos offers a menu of 100 bite-sized sandwiches (bocadillos) with various fillings.... Located near D61 in true Madrid airport. I'm giving this restaurant 5 stars because what more can you ask for? Super cheap, warm and fresh sandwiches. 

I.... I've had 100 Montaditos in NYC. It wasn't until I showed up in Spain did I realize that it's actually a Spanish chain. Makes sense though.

So when I saw.... ",https://www.yelp.com/biz/100-montaditos-madrid-37?adjust_creative=z8U9P3NucyfGO41pAru5Lw&utm_campaign=yelp_api_v3&utm_medium=api_v3_business_search&utm_source=z8U9P3NucyfGO41pAru5Lw,https://s3-media1.fl.yelpcdn.com/bphoto/ITa3TOlOK0zMPOK22kwMtQ/o.jpg,False,€,,[],,,,,,,
23,fNmu0jI1dU2s6SmnCJq4Lw,Mesón Don Fernando,mesón-don-fernando-madrid,"[{'alias': 'diners', 'title': 'Diners'}, {'alias': 'spanish', 'title': 'Spanish'}]",Diners Spanish ,40.4709015,-3.5812299,"Calle del Canal de Suez, 1, Barajas, 28042 Madrid, Spain",+34917477551,5.0,6,"Very average. Saw a bunch of locals seated outside. Wait staff was very helpful. Had the croquettes and spicy potatoes. Both were unspectacular. For a few.... Very helpful staff, very friendly place. Had drinks and dinner for four for 35 euros.. ",https://www.yelp.com/biz/mes%C3%B3n-don-fernando-madrid?adjust_creative=z8U9P3NucyfGO41pAru5Lw&utm_campaign=yelp_api_v3&utm_medium=api_v3_business_search&utm_source=z8U9P3NucyfGO41pAru5Lw,https://s3-media3.fl.yelpcdn.com/bphoto/KK7ZiO_dZZn_Bvz_IV_-fg/o.jpg,False,€,,[],,,,,,,
24,4iqBoREwrYBB2qDLc3a48A,No Q No,no-q-no-madrid,"[{'alias': 'mexican', 'title': 'Mexican'}, {'alias': 'gastropubs', 'title': 'Gastropubs'}, {'alias': 'cocktailbars', 'title': 'Cocktail Bars'}]",Mexican Gastropubs Cocktail Bars ,40.4625088,-3.5921,"Calle Bahía de Palma, 7, 28042 Madrid, Spain",+34917474736,4.0,3,We had one night in Madrid prior to flying back home and found this gem through a little searching. Our hotel was near airport which meant our options were.... ,https://www.yelp.com/biz/no-q-no-madrid?adjust_creative=z8U9P3NucyfGO41pAru5Lw&utm_campaign=yelp_api_v3&utm_medium=api_v3_business_search&utm_source=z8U9P3NucyfGO41pAru5Lw,https://s3-media2.fl.yelpcdn.com/bphoto/Sa7klIdB1dcRMgEpcXOuBQ/o.jpg,False,€€,,[],,,,,,,
25,1b7ra60hPk71-320OKNv4w,La Bekada,la-bekada-madrid,"[{'alias': 'spanish', 'title': 'Spanish'}, {'alias': 'steak', 'title': 'Steakhouses'}]",Spanish Steakhouses ,40.4513207887721,-3.59490207553256,"Calle Catamaran, 3, 28042 Madrid, Spain",+34912343355,3.0,14,"Great service, and even better food. My family and I were staying at a hotel in the vicinity, and La Bekada stood out among the options nearby. Although we.... Able to accommodate us gringos on a late Sunday night close to airport.  Paella was large in size, but tasty.  Good option for this part of town.  Sangria.... I would not consider this spot a steak house but the food was good for a reasonable price. The Burgers and the appetizers appeared more appealing than the.... ",https://www.yelp.com/biz/la-bekada-madrid?adjust_creative=z8U9P3NucyfGO41pAru5Lw&utm_campaign=yelp_api_v3&utm_medium=api_v3_business_search&utm_source=z8U9P3NucyfGO41pAru5Lw,https://s3-media2.fl.yelpcdn.com/bphoto/0iEgkQBFcSauXHBfIHB1Fg/o.jpg,False,€€,,[],,,,,,,
26,bWfb2fZbZqT5VMKteEomcw,Sena,sena-madrid,"[{'alias': 'cafeteria', 'title': 'Cafeteria'}, {'alias': 'spanish', 'title': 'Spanish'}, {'alias': 'tapas', 'title': 'Tapas Bars'}]",Cafeteria Spanish Tapas Bars ,40.4691315,-3.5809801,"Avenida  de Logroño, 104, 28042 Madrid, Spain",+34917473408,5.0,1,,https://www.yelp.com/biz/sena-madrid?adjust_creative=z8U9P3NucyfGO41pAru5Lw&utm_campaign=yelp_api_v3&utm_medium=api_v3_business_search&utm_source=z8U9P3NucyfGO41pAru5Lw,,False,,,[],,,,,,,
27,uHGRsK9tCTVxrsjOgzZIKA,Derzu,derzu-madrid,"[{'alias': 'asianfusion', 'title': 'Asian Fusion'}]",Asian Fusion ,40.4621,-3.59132,"Calle Bahía de Palma, 4, 28042 Madrid, Spain",+34912337148,4.0,3,#madrid #spain Pretty amazing creative Asian food in Madrid. All the server was pretty nice and gentle and our dishes were flawless.. ,https://www.yelp.com/biz/derzu-madrid?adjust_creative=z8U9P3NucyfGO41pAru5Lw&utm_campaign=yelp_api_v3&utm_medium=api_v3_business_search&utm_source=z8U9P3NucyfGO41pAru5Lw,https://s3-media4.fl.yelpcdn.com/bphoto/1DCPm-xkWu8f6g3Pl78G6A/o.jpg,False,,,[],,,,,,,
28,b0HfHLIE0myxxuG__IyxrA,Mcdonalds,mcdonalds-madrid-33,"[{'alias': 'hotdogs', 'title': 'Fast Food'}, {'alias': 'burgers', 'title': 'Burgers'}]",Fast Food Burgers ,40.4690587124797,-3.58193817023923,"Avenida de Logroño, 303, 28042 Madrid, Spain",+34916016047,5.0,1,"Loved this McDonald's! Open air dining and service was prompt. 

If you happen to be staying at the Melia Barajas, it is footsteps away.. ",https://www.yelp.com/biz/mcdonalds-madrid-33?adjust_creative=z8U9P3NucyfGO41pAru5Lw&utm_campaign=yelp_api_v3&utm_medium=api_v3_business_search&utm_source=z8U9P3NucyfGO41pAru5Lw,https://s3-media2.fl.yelpcdn.com/bphoto/RuIo-AosFBns42FG-KLEPw/o.jpg,False,,,[],,,,,,,
29,p3T-bdUrcTVuJRJwK4gRPg,Don Fernando,don-fernando-madrid,"[{'alias': 'spanish', 'title': 'Spanish'}]",Spanish ,40.4709,-3.58123,"Calle Canal de Suez, 1, 28042 Madrid, Spain",+34917477551,4.0,1,,https://www.yelp.com/biz/don-fernando-madrid?adjust_creative=z8U9P3NucyfGO41pAru5Lw&utm_campaign=yelp_api_v3&utm_medium=api_v3_business_search&utm_source=z8U9P3NucyfGO41pAru5Lw,,False,€,,[],,,,,,,
30,SOsOh5ly1Ug9IMqVaCw6xA,Caffriccio,caffriccio-madrid,"[{'alias': 'coffee', 'title': 'Coffee & Tea'}]",Coffee & Tea ,40.47846,-3.5779,"Aeropuerto Madrid, 28042 Madrid, Spain",,4.0,1,,https://www.yelp.com/biz/caffriccio-madrid?adjust_creative=z8U9P3NucyfGO41pAru5Lw&utm_campaign=yelp_api_v3&utm_medium=api_v3_business_search&utm_source=z8U9P3NucyfGO41pAru5Lw,https://s3-media3.fl.yelpcdn.com/bphoto/IR4LOfAFNdJLYyi3eEzdJw/o.jpg,False,,,[],,,,,,,
31,EPzw2VdvmCBx28F8XZXmbg,Sushi & Buey,sushi-y-buey-madrid,"[{'alias': 'japanese', 'title': 'Japanese'}, {'alias': 'burgers', 'title': 'Burgers'}]",Japanese Burgers ,40.46991527,-3.58141959,"Avenida de Logroño, 112, 28042 Madrid, Spain",+34913056592,1.0,7,"While service was good, the food was sub par compared to real Japanese food.  The rice tasted like the ones you can get at supermarkets where I am from.... Ok so trip advisor said that this place was good so we tried it. The food actually made me sick! The fish was not good and the rice was very over cooked. I.... Their sashimi was served at room temperature and the tuna was actually grey. I got sick and finally had to get antibiotics. Great way to start a vacation.. ",https://www.yelp.com/biz/sushi-y-buey-madrid?adjust_creative=z8U9P3NucyfGO41pAru5Lw&utm_campaign=yelp_api_v3&utm_medium=api_v3_business_search&utm_source=z8U9P3NucyfGO41pAru5Lw,https://s3-media2.fl.yelpcdn.com/bphoto/FnqlwQ_KrMB7JRlXcy0XfQ/o.jpg,False,€€,,[],,,,,,,
32,dJHReVQ3k9s5Voxu8v_ejA,El Porton,el-porton-madrid,"[{'alias': 'contractors', 'title': 'General Contractors'}, {'alias': 'restaurants', 'title': 'Restaurants'}]",General Contractors Restaurants ,40.4735826,-3.582031,"Avenida Logroño 148, 28042 Madrid, Spain",+34913295174,4.0,1,,https://www.yelp.com/biz/el-porton-madrid?adjust_creative=z8U9P3NucyfGO41pAru5Lw&utm_campaign=yelp_api_v3&utm_medium=api_v3_business_search&utm_source=z8U9P3NucyfGO41pAru5Lw,,False,,,[],,,,,,,
